{"schema_version":"pedagogical_sample.v2","sample_id":"11111111-1111-4111-8111-111111111111","session_id":"22222222-2222-4222-8222-222222222222","sequence_number":25,"source":"बच्चों, पाँच तक गिनती बोलो।","source_language":"hi","target":"","target_language":"unset","translation_status":"pending","grade":1,"subject":"mathematics","topic":"counting","activity":"oral_practice","learning_objective":"number_recognition","pedagogical_form":"instruction","interaction_type":"teacher_to_class","concept_stage":"practice","examples":[],"expected_learner_response":"oral counting from one to five","translation_notes":"","tts":{"text":"","normalized_text":"","pronunciation_notes":"","speaker_id":"","status":"pending"},"audio":{"path":"audio/11111111-1111-4111-8111-111111111111.wav","sha256":"e3b0c44298fc1c149afbf4c8996fb92427ae41e4649b934ca495991b7852b855","mime":"audio/wav","sample_rate_hz":16000,"channels":1,"duration_ms":38000},"asr":{"status":"available","path":"asr/11111111-1111-4111-8111-111111111111.v1.json","text":"बच्चों, पाँच तक गिनती बोलो।","model_id":"whisper-model-id","model_version":"1.0","verified":false},"annotation":{"status":"unavailable","path":"annotation/11111111-1111-4111-8111-111111111111.v1.json","claims_verified":false,"generated_by":"local-schema-model-id"},"quality":{"rms_db":-22.1,"peak_db":-1.2,"clipping_detected":false,"silence_ratio":0.04,"flags":[]},"provenance":{"created_at":"2026-09-15T00:00:00Z","recorded_start":"2026-09-15T00:00:00Z","recorded_end":"2026-09-15T00:00:38Z","input_device":"phone_microphone","code_switching":false,"processing_state":"READY_FOR_EXPORT","app_version":"0.1.0"},"review":{"status":"unreviewed","reviewer_id":"","reviewed_at":null,"source_audio_checked":false,"pedagogical_fidelity":"pending","notes":""}}